{
  "schema": "podway.output/v1",
  "request_id": "2037d76d-6ea8-42c2-a11f-883248bb8774",
  "command": "session.complete",
  "generated_at": "2026-07-13T03:10:04.123Z",
  "workspace": {
    "uuid": "83f9fbaa-3df8-4c23-8253-f94098b0af63",
    "root": "/Users/example/src/project-wt",
    "latest_workspace_sequence": 42
  },
  "job": {
    "id": "6b8c38e8-0051-475a-a4d0-0cb07eb8fc12",
    "sequence": 42,
    "state": "succeeded",
    "submitted_at": "2026-07-13T03:10:04.100Z",
    "claimed_at": "2026-07-13T03:10:04.104Z",
    "finished_at": "2026-07-13T03:10:04.121Z"
  },
  "session": {
    "id": "c1ddd90d-5b6b-40a9-a814-885c6215b916",
    "title": "fix duplicate login session creation",
    "lifecycle": "running",
    "revision_before": 17,
    "revision_after": 18
  },
  "result": {
    "changed": true,
    "revision_before": 17,
    "revision_after": 18,
    "completed_stage": "verify",
    "active_stage": "review",
    "active_attempt_number": 2
  },
  "warnings": []
}
